{
  "kind": "output-catalog",
  "schemaVersion": "1.0.0",
  "protocolVersion": "1.5.0",
  "documentVersion": "1.0.0",
  "digestAlgorithm": "sha256",
  "canonicalization": "rfc8785",
  "outputs": [
    {
      "outputId": "artifact-review-bundle",
      "title": "Artifact review bundle",
      "outputClass": "D",
      "ownerPackage": "@openplanr/artifact",
      "pathFunctionId": "artifact-bundle-path",
      "pathTemplate": ".planr/artifacts/{artifactId}/bundle.html",
      "sourceOfTruth": false,
      "schemaRef": null,
      "manifestRef": {
        "id": "generated-asset-manifest",
        "version": "1.0.0"
      },
      "generator": {
        "id": "generate-artifact-review-bundle",
        "version": "1.0.0",
        "sourceDigest": "sha256:a9d105c6dbde86d6c325804e9fdda38645ae4a66739c201727ffa473ab197633"
      },
      "validator": {
        "id": "validate-artifact-review-bundle",
        "version": "1.0.0"
      },
      "compatibilityReaders": [
        {
          "package": "@openplanr/artifact",
          "entrypoint": "@openplanr/artifact/artifact-review-bundle"
        }
      ],
      "retentionPolicy": "release",
      "cleanupPolicy": "explicit-owner",
      "mediaTypes": [
        "text/html"
      ],
      "testRefs": [
        "tests/protocol/output-catalog.test.mjs"
      ]
    },
    {
      "outputId": "canonical-skill-source",
      "title": "Canonical skill source",
      "outputClass": "A",
      "ownerPackage": "@openplanr/skill-runtime",
      "pathFunctionId": "skill-source-path",
      "pathTemplate": "skills/{skillId}/SKILL.md",
      "sourceOfTruth": true,
      "schemaRef": null,
      "manifestRef": null,
      "generator": {
        "id": "generate-canonical-skill-source",
        "version": "1.0.0",
        "sourceDigest": "sha256:1246c9215d2318084f993e1aed9551688815807afba66efa8817f428d709896a"
      },
      "validator": {
        "id": "validate-canonical-skill-source",
        "version": "1.0.0"
      },
      "compatibilityReaders": [
        {
          "package": "@openplanr/skill-runtime",
          "entrypoint": "@openplanr/skill-runtime/canonical-skill-source"
        }
      ],
      "retentionPolicy": "project",
      "cleanupPolicy": "never",
      "mediaTypes": [
        "text/markdown",
        "application/json"
      ],
      "testRefs": [
        "tests/protocol/output-catalog.test.mjs"
      ]
    },
    {
      "outputId": "dashboard-contract-data",
      "title": "Dashboard contract data",
      "outputClass": "B",
      "ownerPackage": "@openplanr/protocol",
      "pathFunctionId": "dashboard-data-path",
      "pathTemplate": ".planr/dashboard/{projectId}.json",
      "sourceOfTruth": false,
      "schemaRef": {
        "id": "dashboard-bootstrap",
        "version": "1.2.0"
      },
      "manifestRef": null,
      "generator": {
        "id": "generate-dashboard-contract-data",
        "version": "1.0.0",
        "sourceDigest": "sha256:e3e46f95b203f16b1e49e709dd07a1e2812b3ff551203142f21ade58167e1e0f"
      },
      "validator": {
        "id": "validate-dashboard-contract-data",
        "version": "1.0.0"
      },
      "compatibilityReaders": [
        {
          "package": "@openplanr/protocol",
          "entrypoint": "@openplanr/protocol/dashboard-contract-data"
        }
      ],
      "retentionPolicy": "run",
      "cleanupPolicy": "on-success",
      "mediaTypes": [
        "application/json"
      ],
      "testRefs": [
        "tests/protocol/output-catalog.test.mjs"
      ]
    },
    {
      "outputId": "database-snapshot",
      "title": "Read-only database snapshot",
      "outputClass": "A",
      "ownerPackage": "@openplanr/pipeline",
      "pathFunctionId": "database-snapshot-path",
      "pathTemplate": "output/db/schema.json",
      "sourceOfTruth": true,
      "schemaRef": null,
      "manifestRef": null,
      "generator": {
        "id": "generate-database-snapshot",
        "version": "1.0.0",
        "sourceDigest": "sha256:1c82a03ea0a60184925748203b24fc26c68346733a4fd3009481522347a41d10"
      },
      "validator": {
        "id": "validate-database-snapshot",
        "version": "1.0.0"
      },
      "compatibilityReaders": [
        {
          "package": "@openplanr/pipeline",
          "entrypoint": "@openplanr/pipeline/database-snapshot"
        }
      ],
      "retentionPolicy": "project",
      "cleanupPolicy": "never",
      "mediaTypes": [
        "application/json"
      ],
      "testRefs": [
        "tests/protocol/output-catalog.test.mjs"
      ]
    },
    {
      "outputId": "design-session",
      "title": "Design review session",
      "outputClass": "B",
      "ownerPackage": "@openplanr/design",
      "pathFunctionId": "design-session-path",
      "pathTemplate": ".planr/design/{feature}/session.json",
      "sourceOfTruth": false,
      "schemaRef": {
        "id": "design-session",
        "version": "1.0.0"
      },
      "manifestRef": null,
      "generator": {
        "id": "generate-design-session",
        "version": "1.0.0",
        "sourceDigest": "sha256:ada83f6b464011b19a9fb5d47fe40d40f7c019d07242678eee6e3440af9bb488"
      },
      "validator": {
        "id": "validate-design-session",
        "version": "1.0.0"
      },
      "compatibilityReaders": [
        {
          "package": "@openplanr/design",
          "entrypoint": "@openplanr/design/design-session"
        }
      ],
      "retentionPolicy": "run",
      "cleanupPolicy": "bounded-expiry",
      "mediaTypes": [
        "application/json"
      ],
      "testRefs": [
        "tests/protocol/output-catalog.test.mjs"
      ]
    },
    {
      "outputId": "design-specification",
      "title": "Design specification",
      "outputClass": "A",
      "ownerPackage": "@openplanr/design",
      "pathFunctionId": "design-spec-path",
      "pathTemplate": "output/feats/{feature}/design-spec.md",
      "sourceOfTruth": true,
      "schemaRef": null,
      "manifestRef": null,
      "generator": {
        "id": "generate-design-specification",
        "version": "1.0.0",
        "sourceDigest": "sha256:dda31316791c4cf59d530f35abbb6c73f417ffa8da97a7a3083f667b72da9afd"
      },
      "validator": {
        "id": "validate-design-specification",
        "version": "1.0.0"
      },
      "compatibilityReaders": [
        {
          "package": "@openplanr/design",
          "entrypoint": "@openplanr/design/design-specification"
        }
      ],
      "retentionPolicy": "project",
      "cleanupPolicy": "never",
      "mediaTypes": [
        "text/markdown"
      ],
      "testRefs": [
        "tests/protocol/output-catalog.test.mjs"
      ]
    },
    {
      "outputId": "diagram-set",
      "title": "Verified diagram set",
      "outputClass": "D",
      "ownerPackage": "@openplanr/artifact",
      "pathFunctionId": "diagram-manifest-path",
      "pathTemplate": "diagrams/{slug}/{slug}.manifest.json",
      "sourceOfTruth": false,
      "schemaRef": {
        "id": "diagram-manifest",
        "version": "1.0.0"
      },
      "manifestRef": {
        "id": "diagram-manifest",
        "version": "1.0.0"
      },
      "generator": {
        "id": "generate-diagram-set",
        "version": "1.0.0",
        "sourceDigest": "sha256:133cccc5e17da519a517ce30ccb53876cd365d400e62cc82cc03b2bdc189b5be"
      },
      "validator": {
        "id": "validate-diagram-set",
        "version": "1.0.0"
      },
      "compatibilityReaders": [
        {
          "package": "@openplanr/artifact",
          "entrypoint": "@openplanr/artifact/diagram-set"
        }
      ],
      "retentionPolicy": "project",
      "cleanupPolicy": "explicit-owner",
      "mediaTypes": [
        "application/json",
        "image/png",
        "image/svg+xml",
        "text/html"
      ],
      "testRefs": [
        "tests/protocol/output-catalog.test.mjs"
      ]
    },
    {
      "outputId": "diagram-source",
      "title": "Canonical diagram source",
      "outputClass": "A",
      "ownerPackage": "@openplanr/artifact",
      "pathFunctionId": "diagram-source-path",
      "pathTemplate": "diagrams/{slug}/{slug}.planr-diagram.json",
      "sourceOfTruth": true,
      "schemaRef": {
        "id": "diagram-document",
        "version": "1.0.0"
      },
      "manifestRef": {
        "id": "diagram-manifest",
        "version": "1.0.0"
      },
      "generator": {
        "id": "generate-diagram-source",
        "version": "1.0.0",
        "sourceDigest": "sha256:4b80af9e11a54bc0993b6f5313a47fe5ac497f123e79c056daae7d062f306a84"
      },
      "validator": {
        "id": "validate-diagram-source",
        "version": "1.0.0"
      },
      "compatibilityReaders": [
        {
          "package": "@openplanr/artifact",
          "entrypoint": "@openplanr/artifact/diagram-source"
        }
      ],
      "retentionPolicy": "project",
      "cleanupPolicy": "never",
      "mediaTypes": [
        "application/vnd.openplanr.diagram+json"
      ],
      "testRefs": [
        "tests/protocol/output-catalog.test.mjs"
      ]
    },
    {
      "outputId": "evaluation-report",
      "title": "Evaluation report",
      "outputClass": "B",
      "ownerPackage": "@openplanr/skill-runtime",
      "pathFunctionId": "evaluation-report-path",
      "pathTemplate": "evaluation/results/{runId}.json",
      "sourceOfTruth": false,
      "schemaRef": {
        "id": "evaluation-aggregate-report",
        "version": "1.4.0"
      },
      "manifestRef": null,
      "generator": {
        "id": "generate-evaluation-report",
        "version": "1.0.0",
        "sourceDigest": "sha256:1fd9bc7593b7cef78c83d1cac7f9743ed20526ca23220e042e9e941b1dcc84ad"
      },
      "validator": {
        "id": "validate-evaluation-report",
        "version": "1.0.0"
      },
      "compatibilityReaders": [
        {
          "package": "@openplanr/skill-runtime",
          "entrypoint": "@openplanr/skill-runtime/evaluation-report"
        }
      ],
      "retentionPolicy": "release",